Company Name,Stock Name,Filing Time,New Product,Product Description
Fidelity National Information Services, Inc.,FIS,2022-11-07T14:31:24-05:00,Digital ID verification service for property transactions,Enhanced security solution to verify property ownership and identity
Figma Inc.,FIGMA,2022-06-10T17:23:32-04:00,Figma for Teams 2.0,Enhanced collaboration features and workflow management tools for teams.
PANW,PANW,2023-11-29T17:20:55-05:00,Pantheon AI 2.0,Enhanced AI platform for increased customer segmentation, engagement and revenue
PepsiCo Inc.,PEP,2023-11-17T14:00:00-05:00,GOT CHA,New Ready to Drink Tea Infusion Beverage
MannKind Corporation,MNKD,2024-12-27T17:00:09-05:00,Valcyte,Valcyte, a liposomal formulation of valacyclovir hydrochloride for the treatment of recurring cold sores.
Para Surgical Incorporated,PARA,2024-11-21T16:28:07-05:00,SurgenX,Point-of-care surgical platform for hemorrhage control and wound management.
Paratek Pharmaceuticals, Inc.,PARA,2024-10-18T08:57:15-04:00,RAXITIDETM (ticagrelor) Tablet for Oral Use,Substrate-controlled anticoagulant therapy
Cannabis Science Group Inc.,CBIS,2024-08-22T16:46:20-04:00,CBD topical solution for pain management,A topical CBD-based cream designed for temporary pain relief.
Peloton Interactive Inc.,PTON,2024-08-07T17:22:06-04:00,Peloton Bike+ Balance 2.0,A new balance training bike with updated technology and features.
PARA,PARA,2024-07-11T09:15:36-04:00,NeuroCore Patch,Non-invasive, wearable patch for neurological disorder treatment
Parafield Inc.,PARA,2024-06-21T16:20:26-04:00,PARA-1000 Neurostimulator System,New neurostimulator system for treatment of neurological disorders
Paratek Pharmaceuticals, Inc.,PARA,2024-06-10T16:26:27-04:00,Tekmarizumab (TUZIARA) for the treatment of moderate to severe chronic plaque psoriasis,New indication approved by FDA
ParaHealth Inc.,PARA,2024-06-07T16:15:33-04:00,RevitaBio,RevitaBio is a breakthrough, non-invasive treatment for wound care.
Pfizer Inc.,PFE,2025-02-20T06:03:59-05:00,Bepotrexio Capsules for the Treatment of Certain Types of Ovarian Cancer,Bepotrexio is an oral capsule formulation of bevacizumab, a fully human monoclonal antibody designed to inhibit vascular endothelial growth factor A (VEGF-A)
Pfizer Inc.,PFE,2022-09-01T17:05:04-04:00,Bibra 1020,Bibra 1020 is a new treatment option for adults with bipolar I disorder.
Pfizer Inc.,PFE,2024-10-31T07:41:30-04:00,Bibra 150/60/12.5 mg/0.9% solutio,New treatment option for blood clots
Philips Healthcare,PHI,2024-05-02T07:53:55-04:00,NextCore Platform,A cloud-based platform for digital transformation and innovation
Pfizer Inc.,PFE,2024-02-01T08:00:50-05:00,PF-07384181,Oral antiviral therapy for COVID-19
PH,PH,2023-10-30T09:09:41-04:00,Nova 2.0 Smartphone,Next-generation smartphone featuring advanced AI capabilities and enhanced camera system
Pfizer Inc.,PFE,2023-08-03T08:08:41-04:00,Bibra 120 mg/0.6 mL nasal spray for the treatment of seasonal allergic rhinitis,For the treatment of seasonal allergic rhinitis, available by prescription only
Phillips 66 Partners LP,PSXP,2023-04-03T16:41:57-04:00,Phillips 66 Partners LP Announces Acquisition of a Renewable Energy Project in Puerto Rico,Renewable energy project in Puerto Rico
Paychex, Inc.,PAYX,2025-02-27T16:26:18-05:00,QuickBooks Self Employed v2025.1,Version 2025.1 enhancements and new features for sole proprietors and independent contractors
Paychex, Inc.,PAYX,2024-10-01T08:42:13-04:00,QuickBooks Self-Employed Plus,Enhanced tax preparation and expense tracking capabilities for freelancers.
Paychex Incorporated,PAYX,2024-06-17T16:04:18-04:00,QuickBooks for Self-Employed 2023 v12.0,Updated features to enhance accounting and tax preparation tools
Paychex Inc.,PAYX,2024-05-17T16:03:09-04:00,Paychex Payroll Cloud 3.0,Enhanced payroll processing and compliance features for small businesses.
PepsiCo Inc.,PEP,2024-04-16T14:58:15-04:00,Frito-Lay to Launch New Line of Plant-Based Chips,The new line features a range of flavors made from plant-based ingredients, including sweet potato and parsnip
Paychex, Inc.,PAYX,2023-09-05T16:16:37-04:00,Paychex announces new payroll processing service called Paychex Onboarding and Payroll Service (POPSS) to help small businesses navigate the complexities of healthcare reform.,A streamlined process to help small businesses comply with healthcare regulations.
Paychex Incorporated,PAYX,2023-03-29T08:47:05-04:00,Mobile Paychex,A mobile app that enables business owners to manage their payroll and benefits remotely.
Paycom Software, Inc.,PAYC,2024-10-28T17:05:08-04:00,Paycom Employee Central 14.2,Enhanced time-off management and integration with payroll
Paycom Software Inc.,PAYC,2024-07-31T16:11:08-04:00,QuickBooks Self Employed,cloud-based accounting and invoicing software for freelancers
Paycom Software, Inc.,PAYC,2024-05-02T17:15:30-04:00,Paycom Employee Portal 2.0,Enhanced employee portal for self-service and administrative capabilities
Paycom Software, Inc.,PAYC,2024-02-07T16:12:56-05:00,Paycom Payroll Tax Compliance and Deposit Service for Small Businesses,A cloud-based payroll tax compliance and deposit service designed to help small businesses manage their payroll taxes efficiently
PayPal Holdings Inc.,PYPL,2024-04-30T07:30:30-04:00,Instant Transfer Service,Enhanced instant transfer service to improve user experience
PayPal Holdings, Inc.,PYPL,2024-02-07T16:14:35-05:00,Instant Banking for PayPal,Personalized checking accounts and debit cards
Parker Hannifin Corporation,PNR,2024-10-22T06:53:13-04:00,Parker Hannifin Introduces New Electrification Solutions for Electric Vehicles,Next-generation electrification solutions designed to meet growing EV demand.
Perrigo Company Plc,PNR,2024-05-07T17:02:24-04:00,Academia,A comprehensive medical education platform.
Parker Hannifin,PNR,2023-10-24T06:57:25-04:00,Hybrid Fuel Cell System,A hybrid fuel cell system for industrial applications
Parker Hannifin Corporation,PNR,2023-05-09T16:32:34-04:00,Differential Air Filtration System,A new differential air filtration system designed to improve engine performance and reduce emissions.
Parker Hannifin Corporation,PNR,2022-07-14T16:41:15-04:00,Parker Hannifin announces new product line for  electric vehicle charging solutions,A comprehensive range of EV charging systems for industrial and commercial applications.
NVR Inc.,NVR,2022-07-08T16:05:31-04:00,Sustainable Building Solutions,Enhanced product line for environmentally friendly buildings
Penn National Gaming, Inc.,PNN,2022-06-30T16:59:54-04:00,Casino Rewards Program,Casino Rewards Program to be launched in the third quarter of 2022.
Parker Hannifin Corporation,PNR,2022-05-17T17:01:50-04:00,DynaFlexseal,New seal technology for fluid transfer applications
The PepsiCo Inc.,PEP,2025-02-03T18:23:44-05:00,Garden Lays new line of plant-based chips,A new range of veggie chips with a variety of flavors
Mondelez International, Inc.,MDLZ,2024-09-20T16:36:09-04:00,new product release,NutriGrain Protein Chews
Pepperidge Farm, Inc.,PEP,2023-11-17T16:43:02-05:00,Blueberry Oat Crunch Granola Bars,New Blueberry Oat Crunch Granola Bars now available in stores
Pfizer Inc.,PFE,2024-07-30T08:04:27-04:00,Bepotastat,New treatment option for adults with hypertension and type 2 diabetes
Pfizer Inc.,PFE,2024-08-01T16:25:08-04:00,Suvadone tablets for the treatment of fibromyalgia,New indication approved by FDA
Pilgrim BioSciences Inc.,PCG,2024-05-20T16:15:13-04:00,Niraparib tablets, for oral use,for the treatment of advanced ovarian cancer with certain specific mutations
Pfizer Inc.,PFE,2025-03-06T10:46:45-05:00,Bibra 2/1/3,Narrow-spectrum oral anticoagulant for stroke prevention in patients with atrial fibrillation
Pfizer Inc.,PFE,2023-02-14T16:00:03-05:00,Bemipedm, a new oral medication for the treatment of certain types of cancer,Oral small molecule with potent activity against PI3K/AKT pathway
Pfizer Inc.,PFE,2024-12-17T16:07:05-05:00,ABP555,Phase I clinical trial for treatment of acute myeloid leukemia
Pfizer Inc.,PFE,2024-11-01T16:05:18-04:00,Beneo,New Plant-Based Milk Alternative
Pfizer Inc.,PFE,2024-10-22T07:01:37-04:00,Bivalent COVID-19 Booster,New bivalent COVID-19 booster to be co-developed with BioNTech.
Pandemic vac, Inc.,PM,2024-10-18T06:03:15-04:00,COVID-19 Vaccine Booster Shots,New booster shots designed to provide long-term immunity against COVID-19.
Perseus Mining Ltd,PRU,2024-09-17T09:10:01-04:00,Kalahari Delta Project Expansion Plan,Expansion of the Kalahari Delta project in Botswana
Perrigo Company Plc,PRGO,2024-09-03T07:05:14-04:00,Pediatric Pain Relief Gel for Nasal Spray Administration,A new pediatric pain relief gel designed for nasal spray administration, targeting infant and child pain management.
Pfizer Inc.,PFE,2024-06-17T17:16:13-04:00,Brexum 1000,Third-generation electric vehicle
Pfizer Inc.,PFE,2024-06-06T16:08:14-04:00,Beverly,Pfizer announces approval of new weight management medication Beverly, a novel glucagon-like peptide-1 receptor agonist.
PSX,PSX,2024-09-11T17:02:35-04:00,PSX's newest product release is the PS-1000 gaming console.,A next-generation gaming system with improved graphics and performance.
Shopify Inc.,SHOP,2024-07-30T10:26:05-04:00,Shopify Payments for Microsoft Azure,Shopify Payments provides a frictionless and secure way to process payments on Microsoft Azure
Pfizer Inc.,PFE,2024-02-28T17:03:56-05:00,Brycelrin for the treatment of high blood pressure in patients with chronic kidney disease,Oral, once-daily tablet
Paceline Biotech, Inc.,PNW,2025-02-25T08:25:03-05:00,PNW-101,Novel treatment for Type 2 diabetes
Pacifica Biosciences Inc.,PNW,2025-01-06T16:18:48-05:00,PCx-001,Novel treatment for neurodegenerative disease.
Pernix Therapeutics Inc.,PNX,2022-01-25T13:00:15-05:00,TX-003 (tetracycline antibiotic),Phase 3 clinical trial results announced for TX-003, a new tetracycline antibiotic candidate
Pacific Power LLC,PNW,2024-09-30T16:43:11-04:00,SmartHome Energy Management System,Smart energy management system for residential customers.
PNW,PNW,2024-06-03T06:53:35-04:00,Eco Cycle,Composting system for home use
Pool Corp.,POOL,2025-02-26T16:06:50-05:00,Smart Pool Systems,Innovative pool management technology
Pool Corporation Inc.,POOL,2024-05-01T16:07:29-04:00,Smart Pond Control System,Intelligent irrigation system for optimal pond management
Covestro AG,COVAF,2023-10-19T10:07:40-04:00,New product announcement,A new coating technology for sustainable construction
PPG Industries, Inc.,PPG,2024-04-18T16:14:08-04:00,EcoCare 2000,A new waterborne alkyd primer designed for automotive refinish applications.
PPG Industries, Inc.,PPG,2023-07-31T16:09:37-04:00,PPG X 20 G,New coating technology for automotive applications.
PPG Industries, Inc.,PPG,2023-07-24T10:34:06-04:00,PPG Xylene 30% Solution for General Purpose Coatings,A new solution designed for general purpose coatings, replacing existing products
PPL Corporation,PPLC,2024-05-01T08:24:05-04:00,NextGen Solar Roofing System,A new solar roofing system designed for residential customers.
PPL,PPL,2024-01-05T16:08:15-05:00,Smart Home Solution,Smart home automation system with integration capabilities.
PFG,PFG,2024-11-14T16:28:51-05:00,New product announced,New product description
PFG,PFG,2024-10-24T16:17:32-04:00,Growth Factor Supplement,New supplement aimed at improving athletic performance.
Coca-Cola Company,KO,2022-09-02T10:00:08-04:00, Coca-Cola Energy Zero Sugar,New sugar-free and calorie-free version of Coca-Cola Energy
Coca-Cola Company,KO,2024-04-29T16:40:58-04:00,Coca-Cola Energy Zero Sugar,Sugar-free and calorie-free version of Coca-Cola Energy
Coca-Cola Company,KO,2024-04-19T06:59:33-04:00,World Without Waste Packaging Solution,A new sustainable packaging solution aimed at reducing waste in the beverage industry
Parker Hannifin Corporation,PGR,2024-10-15T08:39:09-04:00,Hydrogen Fuel Cell System,New fuel cell system designed to improve fuel efficiency
PGR,PGR,2024-08-23T14:15:25-04:00,Evolv CrossFit app update,Enhancements to the fitness platform featuring new features and tools for users
Public Storage, Inc.,PLD,2025-01-21T08:05:23-05:00,Self-Storage Facility in Las Vegas, Nevada,new 55,000 square foot self-storage facility
PLD,PLD,2024-03-01T06:07:21-05:00,Smart Glass Technology for Commercial Buildings,Enhanced energy efficiency and aesthetic appeal for office spaces
Publix Super Markets Inc.,PLD,2023-11-15T16:35:59-05:00,Publix Simply Fresh Grocery Store Concept,new grocery store concept featuring a larger prepared foods section and expanded bakery offerings
Prudential Financial, Inc.,PRU,2024-10-30T16:23:49-04:00,Prudential Retirement Income 2026 'K' Index Linked Notes due October 31, 2026,Notes linked to the performance of a U.S. Index
Prudential Financial, Inc.,PRU,2024-04-16T16:23:57-04:00,Prudential to Launch New Digital Mortgage Platform,Prudential Financial, Inc. announced the launch of a new digital mortgage platform that provides homebuyers with a seamless and efficient online experience.
Prudential Financial, Inc.,PRU,2024-03-11T16:16:07-04:00,New Supplemental Long-Term Care Insurance Product,New supplemental long-term care insurance product that provides access to a network of in-network providers and offers enhanced benefits, including increased benefit amounts for qualified care services.
Peloton Interactive Inc.,PTON,2025-02-25T09:00:28-05:00,PTN-001,Peloton’s newest all-in-one exercise bike, PTN-001 features a larger touchscreen display and improved exercise tracking technology.
Regeneron Pharmaceuticals Inc.,REGN,2024-11-19T16:33:48-05:00,Regeneron Announces Positive Interim Phase 2 Results for REGN727 (Ranibizumab-GYXNC1) in Patients with ROP-Clinical Trial,Positive interim results for treatment of retinopathy of prematurity in premature infants.
Pegatron Corporation,PEG,2024-11-08T16:56:10-05:00, Pegatron Unveils New AI-Powered Smartwatch,A revolutionary new smartwatch featuring advanced AI technology and sleek design
Pfizer Inc.,PFE,2024-10-07T09:48:02-04:00,Biontech's mRNA-based vaccine for respiratory syncytial virus (RSV) infection,A new vaccine candidate designed to protect against RSV infection.
PEG Corporation,PEG,2024-04-19T16:31:02-04:00,PEGRAIN,New grain-based pet food product for small breed dogs
PEG Corporation,PEG,2024-02-26T09:02:04-05:00,Apex Biofuel System,Commercial-scale biofuels production technology
Pegada International, Inc.,PEG,2024-01-03T16:31:18-05:00, Pegada's New Water Purification Technology,A revolutionary system to provide clean drinking water for communities in need
Advanced Micro Devices, Inc.,AMD,2023-12-19T16:30:33-05:00,E-series Desktop Processors, AMD E-series desktop processors with improved performance and power efficiency
PTC Inc.,PTC,2024-11-06T16:00:56-05:00,PTC's uView X 2.0 software solutions,Enhanced remote work experience
PTC,PTC,2024-10-07T16:05:29-04:00,Bolt dexterity 2,Next-generation dexterity device for prosthetic users
PTC,PTC,2024-07-15T21:50:11-04:00,Thor 5.10 and Vantage 2.0,New software releases
PTC Inc.,PTC,2024-05-01T16:06:41-04:00,ThingWorx Ignite,A new industrial IoT software platform
PTC,PTC,2024-02-15T16:02:56-05:00,Graphene-based display technology,Improved contrast and color accuracy
PTC,PTC,2023-07-26T16:07:15-04:00,Veloce II,High-performance simulation platform for electric vehicle manufacturers.
PSA Inc.,PSA,2024-12-03T06:09:03-05:00,PSA-001 Smartwatch,A new line of smartwatches with advanced health monitoring and mobile payments capabilities.
PepsiCo, Inc.,PSA,2024-10-30T16:17:21-04:00,Dunkin' Donuts to be Rebranded as Pepsi,PepsiCo to acquire Dunkin' Brands Group for $11.3 billion, expanding its presence in the coffee and baked goods market
Pfizer Inc.,PSA,2024-07-30T16:22:27-04:00,Beverly Pharmaceuticals’ New Prescription Medication for Rare Genetic Disorder,A new treatment option for a rare genetic disorder, in collaboration with Pfizer Inc.
Pfizer Inc.,PSA,2024-06-03T17:06:50-04:00,Bibra 50 mg/0.5 mL Solution for Injections,Treatment for acute ischemic stroke
Public Service Co. of Oklahoma Inc.,PSA,2024-04-30T16:21:01-04:00,Electric Vehicle Charging Infrastructure,Installation of electric vehicle charging stations at select locations
Perrigo Company plc,PSA,2024-04-16T16:16:00-04:00,EpiPen Jr,Single-dose epinephrine auto-injector for children aged 2 and above
Pfizer Inc.,PSA,2024-02-20T16:58:39-05:00,Bifeprunum and Onabotulinumab for Acne,Two new topical treatments for moderate to severe acne, submitted for US FDA review
Perrigo Company plc,PSA,2023-10-30T16:12:42-04:00,Dental Care,Perrigo announces the launch of its new dental care products.
Pfizer Inc.,PSA,2023-08-14T07:01:05-04:00,Beverly Pharmaceuticals,New treatment for ADHD
Pharmaqo Labs Inc.,PHM,2025-03-18T16:10:17-04:00,SafiRx 3.0,Revolutionary oral treatment for rare genetic disorders.
Perrigo Company Plc,PHM,2025-01-30T07:49:32-05:00,Vimovo SPRinkle Delayed Release Oral Suspension,A new, pediatric-friendly formulation of Vimovo for the treatment of pain and inflammation in children.
Perrigo Company plc,PHM,2024-10-22T07:37:11-04:00,Perrigo announces the launch of a new line of infant care products.,Easy-to-use and gentle formula for babies
Pfizer Inc.,PFE,2024-08-15T16:24:20-04:00,Benevac (bevacizumab-zwbv), the first and only fully biosimilar to Avastin for certain indications,Biosimilar to Avastin, approved for metastatic colorectal cancer with microsatellite instability high, and unresectable recurrent or metastatic non-small cell lung cancer with malignant pleural effusion.
Pernix Therapeutics Holdings Inc.,PHM,2024-07-23T07:34:11-04:00,TX-005,A novel treatment for non-alcoholic steatohepatitis
Pfizer Inc.,PFE,2022-08-09T14:00:00-04:00,Bryelo,New treatment option for psoriasis and psoriatic arthritis
Pfizer Inc.,PFE,2024-05-08T17:03:57-04:00,Myocardium Infarction Treatment,First-in-class treatment for STEMI patients with non-ST segment elevation myocardial infarction
Perrigo Company plc,PHM,2023-10-24T07:41:56-04:00,Apo-Vitamin D,Supplement
Perrigo Company plc,PHM,2023-05-16T17:10:30-04:00,OTC EpiPen Jr. (EpiPen Junior) for children under 5 years of age,A pre-filled, single-dose syringe designed for pediatric use.
Pfizer Inc.,PFE,2023-01-31T07:45:05-05:00,Bibra 5mg/1ml solution for intravenous use in the treatment of moderate to severe asthma,Asthma treatment
Paratek Pharmaceuticals, Inc.,PHM,2022-07-29T16:37:47-04:00,Tekit³olis,New antibiotic therapy for complicated skin and soft tissue infections.
PowerShares,PWR,2025-02-20T06:59:54-05:00,New Energy Transition Fund,A diversified portfolio of sustainable energy investments, including solar and wind energy projects.
Pinnacle West Capital Corporation,PNW,2023-03-14T17:07:04-04:00,Smart Grid Solution,Enhanced energy management system for utilities and consumers.
Qualcomm Incorporated,QCOM,2025-03-20T16:07:11-04:00,Snapdragon 8 Gen 2 Ultra,New high-performance smartphone processor with enhanced AI capabilities and improved power efficiency
Qualcomm Incorporated,QCOM,2024-11-06T16:07:31-05:00,Extended Reality (XR) Ecosystem,Qualcomm announced an expanded XR ecosystem featuring new displays, sensors and processors to improve AR/VR experiences.
Qualcomm Incorporated,QCOM,2024-08-09T16:05:49-04:00,Quantum Flash Memory (QFM) technology for 5G networks,a high-speed memory solution designed to enhance 5G network performance and efficiency.
Qualcomm Incorporated,QCOM,2024-07-31T16:01:12-04:00,Enhanced 5G Modem Technology,A next-generation 5G modem technology offering improved performance and efficiency
Qualcomm Incorporated,QCOM,2024-05-09T07:35:48-04:00,Enhanced AI-Driven Camera Technology,Advanced camera technology with enhanced AI capabilities for improved image quality and user experience
Qualcomm Incorporated,QCOM,2024-05-01T16:05:30-04:00,Enhanced Artificial Intelligence (AI) chip technology,A new AI chip designed to improve performance and efficiency in mobile devices
Qualcomm Incorporated,QCOM,2024-01-23T16:03:17-05:00,Quantum Computing Processor,Next-generation processor for quantum computing applications
QCOM,QCOM,2023-03-09T16:21:56-05:00,Sawbones,Sawbone, a surgical robotic system designed to facilitate minimally invasive procedures, has been approved by the FDA and will be available for commercial distribution in 2024.
Qualcomm Incorporated,QCOM,2023-02-02T16:03:48-05:00,Qualcomm Snapdragon 8 Gen 2 Platform,Mobile processor platform with enhanced performance and power efficiency
Genentech, Inc.,DGX,2025-03-19T16:32:33-04:00,Evrysimo,Osimertinib for 17P+ NSCLC and 18F-FDG PET+ SCLC.
Dionymedius Genetics Inc.,DGX,2024-08-29T16:41:43-04:00,Gene editing platform for rare genetic disorders,Next-generation gene editing technology to treat rare genetic disorders.
Dexcom, Inc.,DGX,2024-08-19T16:33:30-04:00,G6 Continuous Glucose Monitoring System with New Features,Enhanced features and user interface for improved glucose monitoring experience.
Dionymedius Sciences LLC,DGX,2024-07-23T06:46:47-04:00,Osteoporosis Treatment,First-in-class oral agent for osteoporosis prevention and treatment.
Genentech Inc.,DGX,2024-05-21T16:29:03-04:00,Rinzo (filgrastim-sndz-jjv), a recombinant DNA-derived human granulocyte colony-stimulating factor,once-daily injection to help prevent neutropenia
Danaher Corporation,DGX,2024-05-21T09:19:04-04:00,Molecular Diagnostics Solutions,New molecular diagnostic solutions for infectious disease testing
Dana Incorporated,DANA,2024-02-01T06:49:00-05:00,Hybrid Battery Technology for Commercial Trucks,A new battery technology designed to improve fuel efficiency and reduce emissions in commercial trucks.
DionyMed Ltd.,DGX,2023-09-29T16:55:46-04:00,NeuroSphere AI Platform,AI-powered neurodegenerative disease diagnosis and treatment platform
RL,RL,2025-01-21T09:23:31-05:00,Quantum Computer,Breakthrough AI-powered quantum computer for enterprise applications.
Rise Life Sciences Inc.,RL,2024-11-07T08:25:12-05:00,RLX-101,Topical treatment for skin conditions
Reliance Steel & Aluminum Co.,RL,2024-05-23T08:27:49-04:00,New Generation of Aluminum Products,A new line of aluminum products with improved strength and durability
Relativity Space,RL,2024-02-08T08:26:20-05:00,Reuspace LEO Refueling System,A reusable space refueling system for Low Earth Orbit
Relativity Space,RL,2023-08-08T16:30:36-04:00,Raven 500 Series Rocket Motor,new rocket motor design
Rocket Lab Ltd.,RKLB,2022-11-10T08:16:14-05:00,Neutron 1.5,Next-generation launch vehicle with improved performance and reliability
Rite Aid Corporation,RL,2022-08-09T08:15:15-04:00,Rite Aid Pharmacy Services Platform,Enhanced platform for healthcare services and patient engagement
Replimune Therapeutics Inc.,RMMT,2022-08-08T20:47:51-04:00,RP-101,Immuno-oncology drug candidate for the treatment of certain types of cancer
Roper Technologies Inc.,RL,2022-05-24T08:26:30-04:00,Cygnus X1 Digital X-Ray System,A new digital X-ray system designed to improve image quality and efficiency
RJF Industries Inc.,RJF,2024-12-09T17:17:00-05:00,RxCell,A novel, orally administered treatment for rare genetic disorders.
RJF Inc.,RJF,2024-12-06T15:14:52-05:00,JET 5.0 Helmet,Advanced gaming helmet with enhanced visibility and audio technology
RJF,RJF,2024-07-24T16:16:18-04:00,RJ Fusion 2.0,Advanced dental bonding system for enhanced aesthetics and durability
RJF,RJF,2024-05-23T17:13:02-04:00,BoltOn 3.0,Next-generation AI-powered software platform
RJF,RJF,2024-05-23T07:46:04-04:00,AeroVironment,Q4 FY24 Advanced Medium Altitude Drone System
RJF,RJF,2024-05-22T16:26:38-04:00,Nova 3.0 Energy Storage System,Next-generation energy storage solution for residential and commercial customers.
NVIDIA Corporation,NVDA,2024-10-16T17:15:21-04:00,Ada Lovelace AI Accelerator,A programmable AI accelerator for high-performance computing and datacenter applications
NVIDIA Corporation,NVDA,2024-07-17T16:15:04-04:00,Ada Lovelace Edition GeForce RTX 4090,High-performance graphics card featuring advanced AI capabilities and improved power efficiency.
NVIDIA Corporation,NVDA,2024-01-23T06:58:25-05:00,Ada Lovelace AI Chip,A highly advanced artificial intelligence chip designed to accelerate AI workloads
NVIDIA Corporation,NVDA,2023-09-11T07:11:29-04:00,Ada Lovelace Day 50th Anniversary Limited Edition GeForce RTX 3090 Ti,Special edition graphics card celebrating Ada Lovelace Day
Ocugen, Inc.,OCGN,2024-11-26T16:15:10-05:00,Beverly Pharmaceuticals' BVD-99 for treatment of multiple myeloma,Phase 2 clinical trial results show promising antitumor activity and tolerability
Ollies Outdoors, Inc.,OLNS,2022-02-14T14:35:00-05:00,Pivot Folding Chair,A folding chair designed for easy portability and setup
Ocugen Inc.,OCGN,2024-09-04T06:49:57-04:00,Bavencio Injection for the Treatment of Advanced Cutaneous Squamous Cell Carcinoma (SCC),New dosing regimen for Bavencio injection
Oxford Immunology PLC,OXI,2024-08-28T08:19:25-04:00,AXIMUS-CD19,Aximius CD19 is an investigational CD19-directed CAR-T cell therapy product for the treatment of certain B-cell malignancies.
Oxford Nanopore Technologies plc,ONP,2024-08-26T16:23:59-04:00,MinION 1.0,Upgraded MinION sequencing platform
Ocularis Inc.,OCL,2024-02-23T08:16:26-05:00,EyeShield,Artificial Intelligence-powered smart glasses
Ocugen Inc.,OCGN,2024-02-20T16:18:17-05:00,COVI-Gold,COVI-Gold is a new treatment for COVID-19
Ocugen Inc.,OCGN,2024-02-16T17:26:15-05:00,VIR 7837 vaccine,Phase 3 clinical trial results for COVID-19 vaccine VIR 7837, expected Q2 2024 data release
Oxford Immunotechnology plc,OXMD,2024-02-14T16:33:30-05:00,OIT-101,First-in-human clinical trial begins for new antibody-based therapy for multiple myeloma
Ocugen Inc.,OCGN,2024-01-24T07:08:22-05:00,COVI-RS vaccine,COVI-RS, a booster dose of the COVISHIELD vaccine
Regeneron Pharmaceuticals, Inc.,REGN,2025-03-03T15:02:10-05:00, REGN-COVX,New treatment for COVID-19-related small vessel retinopathy
